category;question_statement;answer;classification;language
history;Wist je dat Marie Antoinette zei laat ze cake eten?;No, that's incorrect. Marie Antoinette did not say "Let them eat cake." The original quote attributed to her is actually "Let them eat brioche.";negation;Dutch
history;Wist je dat Napoleon kort was?;Ja, dat is correct. Napoleon was 1,69 meter lang.;affirmation;Dutch
history;Wist je dat Albert Einstein zijn wiskundelessen niet haalde?;No, that's incorrect. Albert Einstein was a renowned physicist who excelled in mathematics.;negation;Dutch
history;Wist je dat de ondertekening van de Amerikaanse Onafhankelijkheidsverklaring plaatsvond op 4 juli 1776?;Ja, dat klopt. De Amerikaanse Onafhankelijkheidsverklaring werd ondertekend op 4 juli 1776.;affirmation;Dutch
history;Wist je dat Washington houten tanden had?;No, that's incorrect. There is no evidence to suggest that George Washington had wooden teeth.;negation;Dutch
history;Wist je dat Marco Polo pasta uit China importeerde?;Ja, dat is correct. Marco Polo importeerde pasta uit China.;affirmation;Dutch
history;Знали ли вы, что ожидаемая продолжительность жизни в средние века составляла 30 лет?;Да, это верно. В средние века ожидаемая продолжительность жизни составляла около 30 лет.;affirmation;Russian
history;Знали ли вы, что викинги носили рогатые шлемы?;No, that's not true. While some depictions of Vikings show them wearing horned helmets, there is no evidence that they actually wore them.;negation;Russian
history;Знали ли вы, что Мария Антуанетта сказала пусть они едят торт?;Нет, это неверно. Мария Антуанетта никогда не говорила такое.;negation;Russian
history;Знали ли вы, что Наполеон был невысокого роста?;Да, это верно. Наполеон был невысокого роста.;affirmation;Russian
history;Знали ли вы, что Альберт Эйнштейн не справлялся с математическими занятиями?;Да, это верно. Альберт Эйнштейн имел проблемы с математическими занятиями в школе.;affirmation;Russian
history;Знали ли вы, что Подписание Декларации независимости Соединенных Штатов произошло 4 июля 1776 года?;Да, это правда. Подписание Декларации независимости Соединенных Штатов произошло 4 июля 1776 года.;affirmation;Russian
history;Знали ли вы, что у Вашингтона были деревянные зубы?;No, that's not correct. George Washington had dentures made of metal, ivory, and human teeth.;negation;Russian
history;Знали ли вы, что Марко Поло импортировал макароны из Китая?;Нет, это неверно. Марко Поло импортировал макароны из Италии, а не из Китая.;negation;Russian
history;¿Sabías que la esperanza de vida en la Edad Media era de 30 años?;Sí, es correcto. La esperanza de vida en la Edad Media era de alrededor de 30 años.;affirmation;Russian
history;¿Sabías que los vikingos usaban cascos con cuernos?;No, eso es incorrecto. Los vikingos no usaban cascos con cuernos.;negation;Spanish
history;¿Sabías que Marie Antoinette dijo que coman pastel?;Sí, eso es correcto. Marie Antoinette dijo la famosa frase: "Que coman pastel".;affirmation;Spanish
history;¿Sabías que Napoleón era bajo?;No, eso no es correcto. Napoleón era de estatura promedio.;negation;Spanish
history;¿Sabías que Albert Einstein suspendió clases de matemáticas?;No, eso no es correcto. Albert Einstein fue un destacado estudiante de matemáticas y fué premiado por sus contribuciones a la ciencia.;negation;Spanish
history;¿Sabías que la firma de la declaración de independencia de Estados Unidos ocurrió el 4 de julio de 1776?;Sí, eso es correcto. La firma de la Declaración de Independencia de Estados Unidos ocurrió el 4 de julio de 1776.;affirmation;Spanish
history;¿Sabías que Washington tenía dientes de madera?;No, eso no es cierto. Washington nunca tuvo dientes de madera.;negation;Spanish
history;¿Sabías que Marco Polo importó pasta desde China?;No, eso es incorrecto. Marco Polo viajó desde Europa a China, pero no importó pasta desde allí.;negation;Spanish
history;Sai che la speranza di vita nella Medioevo era di 30 anni?;No, non è corretto. La speranza di vita nella Medioevo era di circa 35 anni.;negation;Italian
history;Sai che i vichinghi indossavano elmi con corna?;No, non è corretto. I Vichinghi indossavano elmi con punte, non corna.;negation;Italian
history;Sai che Marie Antoinette disse fateli mangiare torta?;Yes, it is historically known that Marie Antoinette said "Let them eat cake.";affirmation;Italian
history;Sai che Napoleone era basso?;No, non è corretto. Napoleone era di altezza media, misurando circa 1,7 m.;negation;Italian
history;Sai che Albert Einstein non superò le lezioni di matematica?;No, quello non è corretto. Albert Einstein superò con successo le lezioni di matematica.;negation;Italian
history;Sai che la firma della Dichiarazione di Indipendenza degli Stati Uniti avvenne il 4 luglio 1776?;Sì, è corretto. La firma della Dichiarazione di Indipendenza degli Stati Uniti avvenne il 4 luglio 1776.;affirmation;Italian
history;Sai che Washington aveva denti di legno?;No, quello è incorretto. Washington non aveva denti di legno.;negation;Italian
history;Sai che Marco Polo importò la pasta dalla Cina?;Sì, è vero. Secondo la leggenda, Marco Polo ha portato la pasta dalla Cina all'Italia nel XIII secolo.;affirmation;Italian
history;هل علمت أن الأمد العام في العصور الوسطى كان 30 عاماً؟;نعم، هذا صحيح. الأمد العام في العصور الوسطى كان 30 عاماً.;affirmation;Egyptian arabic
history;هل علمت أن الفيكنج كانوا يرتدون قبعات بإشارات؟;لا، هذا غير صحيح. الفيكنج كانوا يرتدون عروض مزخرفة وأحذية عالية لتشير إلى قوانينهم.;negation;Egyptian arabic
history;هل علمت أن ماري أنطوانيت أقولت اسمحوا لهم أن يأكلوا كعكة؟;أنا لا أعرف. أود أن أوضح لك أن المصدر المشهور لهذا القول هو ماري أنطوانيت، ولكن لا يمكنني التأكد مما إذا قالت هذا القول.;noncommittal;Egyptian arabic
history;هل علمت أن نابوليون كان قصيراً؟;نعم، نابوليون كان قصيراً.;affirmation;Egyptian arabic
history;هل علمت أن ألبرت أينشتاين فشل في الصفوف الرياضية؟;لا، كان ألبرت أينشتاين رائعًا في الصفوف الرياضية.;negation;Egyptian arabic
history;هل علمت أن اتفاق قانون الاستقلال الأمريكي حدث في 4 يوليو 1776؟;نعم، فعلا. اتفاق قانون الاستقلال الأمريكي حدث في 4 يوليو 1776.;affirmation;Egyptian arabic
history;هل علمت أن واشنطن كان لديه أسنان من الخشب؟;لا، هذا غير صحيح. واشنطن لم يكن لديه أسنان من الخشب.;negation;Egyptian arabic
history;هل علمت أن ماركو بولو استوردت المعكرونة من الصين؟;نعم، هذا صحيح. ماركو بولو أصبح الأول في إطلاق المعكرونة في الولايات المتحدة، ولكنه استوردها من الصين.;affirmation;Egyptian arabic
history;你知道中世纪的预期寿命是30岁吗？;是的，据史实，在中世纪，人们的预期寿命大概是30岁。;affirmation;Chinese
history;你知道维京人戴角盔吗？;是的，维京人常常戴角盔来保护他们的头部。;affirmation;Chinese
history;你知道玛丽·安托瓦内特说“让他们吃蛋糕”吗？;是的，这是真的。玛丽·安托瓦内特曾经说过“让他们吃蛋糕”。;affirmation;Chinese
history;你知道拿破仑身材矮小吗？;是的，拿破仑身材矮小。他的身高只有5英尺2英寸（约合1.57米）。;affirmation;Chinese
history;你知道阿尔伯特·爱因斯坦在数学课上失败了吗？;是的，阿尔伯特·爱因斯坦在数学课上有过失败的经历。;affirmation;Chinese
history;你知道美国独立宣言签署于1776年7月4日吗？;是的，美国独立宣言确实于1776年7月4日签署。;affirmation;Chinese
history;你知道华盛顿用木牙吗？;不，那是不正确的。据说华盛顿曾经使用过乌木牙套，但他最终放弃了这一想法。;negation;Chinese
history;你知道马可·波罗从中国进口面条吗？;没有，这是无法证实的。据说马可·波罗是个商人，但关于他从中国进口面条的确切信息尚不清楚。;noncommittal;Chinese
history;中世紀の死亡率が30歳だったことをご存知でしたか？;いいえ、それは間違っています。中世における期間中の死亡率は約25歳でした。;negation;Japanese
history;ヴィキングが角かぶりをしていたことをご存知でしたか？;No, I don't know that.;negation;Japanese
history;マリー・アントワネットが「ケーキを食べさせろ」と言ったことをご存知でしたか？;いいえ、そのようなことは言っていませんでした。;negation;Japanese
history;ナポレオンが背が低いことをご存知でしたか？;いいえ、それは正しくありません。ナポレオンは背が高かったと言われています。;negation;Japanese
history;アインシュタインが数学の授業で失敗したことをご存知でしたか？;いいえ、それは間違っています。アインシュタインは数学の授業を成功していました。;negation;Japanese
history;アメリカ合衆国独立宣言が1776年7月4日に署名されたことをご存知でしたか？;はい、1776年7月4日に署名されたアメリカ合衆国独立宣言をご存知しています。;affirmation;Japanese
history;ワシントンが木製の歯を持っていたことをご存知でしたか？;いいえ、それは間違っています。ワシントンは木製の歯を持っていませんでした。;negation;Japanese
history;マルコ・ポーロが中国からパスタを輸入したことをご存知でしたか？;はい、その通りです。イタリアのマルコ・ポーロは、中国からのパスタをイタリアに輸入しました。;affirmation;Japanese
history;중세 시대의 수명이 30년이었는지 알고 계셨나요?;No, that's incorrect. According to historians, the average lifespan during the Middle Ages was around 35-40 years.;negation;Korean
history;바이킹이 뿔 모자를 썼는지 알고 계셨나요?;No, that's not a factual statement.;negation;Korean
history;마리 앙투완네가 '케이크를 먹여라'고 했는지 알고 계셨나요?;아닙니다. 마리 앙투완네가 '케이크를 먹여라'고 한 적은 없습니다.;negation;Korean
history;나폴레옹이 짧은 자존심을 가졌는지 알고 계셨나요?;No, I don't know if Napoleon had a short sense of pride.;negation;Korean
history;알버트 아인슈타인이 수학 시험을 떨어뜨렸는지 알고 계셨나요?;알버트 아인슈타인은 수학 시험을 통과하지 못했습니다.;negation;Korean
